{
  "artifact_id": "talent-profile-report-department-daily-20260723",
  "classification": "restricted-sensitive",
  "correlation_id": "report-profile-portfolio-20260723",
  "customer_data": false,
  "department_id": "profile-portfolio",
  "digest_sha256": "9bd7eb6f5360ead46c9481b85995b37aabc74513aa7b12ac56e88dcaa21cea5a",
  "external_actions": false,
  "headquarters_id": "talent-management",
  "media_type": "application/json",
  "operational_report_id": "talent-profile-report-department-daily-20260723",
  "receipt_id": "receipt-24570e137ea09b46e143299d",
  "reporting_team_id": "profile-portfolio-team-01",
  "request_id": "request-talent-profile-daily-20260723",
  "root_id": "corporate-report-sharepoint-mount",
  "schema": "vpremises://contracts/mounted-sharepoint-report-receipt/v1",
  "schema_id": "estate://operations/department-daily-report/v1",
  "size_bytes": 2241
}
